{"_type":"https://in-toto.io/Statement/v1","predicate":{"attribution":{"rule":"anchored-blame/v1","unanchored_rows":0,"window_hours":24},"commits":[{"anchor":"absolute","files":["crates/core/src/turns.rs"],"sessions":["1fdeeda2e83ab7f1"],"sha":"a1b2c3d4e5f60718293a4b5c6d7e8f9001122334"},{"anchor":"relative_to_session_repo","files":["crates/schema/src/work_receipt.rs","docs/schemas/work-receipt-v1.json"],"sessions":["b2bed7c28f188de2"],"sha":"9e8f7a6b5c4d3e2f1a0b9c8d7e6f5a4b3c2d1e0f"},{"anchor":null,"files":[],"sessions":[],"sha":"5d4c3b2a1f0e9d8c7b6a59483726150f0e0d0c0b"}],"created_at":"2026-10-20T09:41:00Z","generator":{"name":"archie","version":"0.1.30"},"index":{"last_session_at":"2026-10-20T09:30:00Z","parser_version_min":7},"range":{"base":"0123456789abcdef0123456789abcdef01234567","commits":3,"head":"a1b2c3d4e5f60718293a4b5c6d7e8f9001122334","rule":"upstream..HEAD"},"receipt_version":1,"redaction":{"fields_dropped":["source_path","db_path","prompt_preview","commands","quotes"],"policy":"publication/v1"},"sessions":[{"adapter":"claude_code","ended_at":"2026-10-20T09:30:00Z","highest_rung":3,"models":["claude-opus-4-5"],"ref":"1fdeeda2e83ab7f1","risk":{"demoted_claims":0,"governor_halts":0,"known":true,"loop_alerts":1,"recoveries":2,"unresolved_loops":0},"rungs":[{"command_class":"cargo test","confidence_bp":8500,"event_seq":412,"kind":"test_or_build_passed","rung":3,"source":"shell_exit_0","test_origin":"unknown","verified_locally":true},{"command_class":null,"confidence_bp":3500,"event_seq":455,"kind":"done_claimed","rung":1,"source":"assistant_claim","test_origin":null,"verified_locally":false}],"spend_micro_usd":null,"started_at":"2026-10-20T08:02:00Z","tokens_total":1840000},{"adapter":"codex","ended_at":"2026-10-20T07:58:00Z","highest_rung":2,"models":["gpt-5-codex"],"ref":"b2bed7c28f188de2","risk":{"demoted_claims":0,"governor_halts":0,"known":false,"loop_alerts":0,"recoveries":0,"unresolved_loops":0},"rungs":[{"command_class":null,"confidence_bp":9000,"event_seq":88,"kind":"artifact_changed","rung":2,"source":"file_change","test_origin":null,"verified_locally":true}],"spend_micro_usd":null,"started_at":"2026-10-20T07:15:00Z","tokens_total":412000}],"signer":{"public_key":"ssh-ed25519 AAAAC3NzaC1lZDI1NTE5AAAAINdamAGCsQq31Uv+08lkBzoO4XLz2qYjJa8CGmj3B1Ea"},"truncated":false},"predicateType":"https://agentworth.dev/work-receipt/v1","subject":[{"digest":{"gitCommit":"a1b2c3d4e5f60718293a4b5c6d7e8f9001122334"},"name":"commit"},{"digest":{"gitCommit":"9e8f7a6b5c4d3e2f1a0b9c8d7e6f5a4b3c2d1e0f"},"name":"commit"},{"digest":{"gitCommit":"5d4c3b2a1f0e9d8c7b6a59483726150f0e0d0c0b"},"name":"commit"}]}